ad_id,text,date_posted
0,Random ad that doesn't have any merit,"01-01-2020"
1,This is a truly great soap and the 5 dollar price is great,"01-01-2020"
2,This is a truly great chair and the 10 dollar price is great,"01-01-2020"
3,This is a truly great hat and the 3 dollar price is great,"02-01-2020"
4,This is a truly great blue pen and the 3 dollar price is so good,"02-01-2020"
5,I made 30k working on this job - call 123.456.7890 or visit scam.com,"02-01-2020"
6,I made 30k working from home - call 123.456.7890 or visit fraud.com,"02-01-2020"
7,Happy birthday to my dear friend Mike,"02-01-2020"